{
  "title": "02 db templating",
  "pipelineId": "2",
  "canonicalPipeline": "db-templating",
  "suggestedModalities": [
    "video",
    "social",
    "interactive-web"
  ],
  "videoConfig": {
    "aspectRatio": "16:9",
    "fps": 60,
    "canvas": {
      "aspectRatio": "16:9",
      "fps": 60,
      "resolution": "1080p",
      "colorGrading": {
        "lutPreset": "clean_tech",
        "contrast": 1.1,
        "saturation": 1.15,
        "vignette": 0.1
      }
    },
    "audioStaging": {
      "autoDucking": true,
      "duckingAttenuationDb": -12,
      "masterBgmVolume": 0.3,
      "masterSfxVolume": 0.6
    },
    "typography": {
      "preset": "bold_headline",
      "placement": "bottom",
      "fontSize": 36,
      "primaryColor": "#F8FAFC",
      "highlightColor": "#38BDF8"
    },
    "archetypeDirectives": {
      "chartVisuals": {
        "animationCurve": "cubic-bezier(0.4, 0, 0.2, 1)",
        "cameraZoomOnLeaderChange": true,
        "glowIntensity": 0.6,
        "showGridLines": true
      }
    },
    "roleDirectives": {
      "hook": {
        "cameraMotion": {
          "type": "static"
        },
        "sfxCues": [
          {
            "sfxType": "impact_bass",
            "offsetMs": 0,
            "volume": 0.6
          }
        ]
      }
    },
    "depth3d": {
      "enabled": true,
      "mode": "isometric_podium",
      "frameStyle": "cinema",
      "popOutIntensity": 1.3,
      "shadow": true
    },
    "overlayComposite": "sci_fi_hud",
    "sfx": [
      {
        "source": "assets/sfx_data_blip.wav",
        "time": 0.2,
        "duration": 0.5,
        "volume": 0.9,
        "duckBgm": false
      },
      {
        "source": "assets/sfx_sub_drop.wav",
        "time": 2,
        "duration": 2,
        "volume": 1,
        "duckBgm": true
      }
    ]
  }
}